product_name,company_name,brand,spf,pa,image_url,official_url,info_url,ingredients,notes
ビオレ UV アクアリッチ ウォータリーホールドクリーム,花王,ビオレUV,SPF50,PA+++,https://kao-h.assetsadobe3.com/is/image/content/dam/sites/kao/www-kao-kirei-com/jp/ja/item/khg/bioresarasarauv/25327000/GG01.jpg,https://www.kao-kirei.com/ja/item/khg/bioresarasarauv/4901301450883/,https://www.cosme.net/products/10266278/,水、トリ(カプリル酸/カプリン酸)グリセリル、酸化チタン、BG、イソヘキサデカン、イソノナン酸イソノニル、イソノナン酸イソトリデシル、ジカプリン酸ネオペンチルグリコール、プロパンジオール、トリエチルヘキサノイン、ジエチルヘキサン酸ネオペンチルグリコール、水酸化Al、ステアリン酸、ポリソルベート60、セタノール、ベヘン酸グリセリル、ジステアリン酸ソルビタン、水添ポリイソブテン、ステアロイルメチルタウリンNa、(アクリル酸ヒドロキシエチル/アクリロイルジメチルタウリンNa)コポリマー、トリポリヒドロキシステアリン酸ジペンタエリスリチル、ジイソステアリン酸ポリグリセリル-2、ステアロイルグルタミン酸、(アクリル酸Na/アクリロイルジメチルタウリンNa)コポリマー、アルギニン、ステアリルアルコール、ポリヒドロキシステアリン酸、EDTA-2Na、トロメタミン、パルミチン酸デキストリン、ポリソルベート80、水酸化K、シア脂、フェノキシエタノール、デヒドロ酢酸Na、キサンタンガム、香料,全成分は花王公式。ノンケミカル(紫外線吸収剤フリー)表記あり。
ビオレ UV アクアリッチ エアリーホールドクリーム,花王,ビオレUV,SPF50+,PA++++,要確認,https://www.kao-kirei.com/ja/item/khg/bioresarasarauv/4901301463593/,https://www.kao-kirei.com/ja/item/khg/bioresarasarauv/4901301463593/,水、メトキシケイヒ酸エチルヘキシル、エタノール、BG、エチルヘキシルトリアゾン、シリカ、ジエチルアミノヒドロキシベンゾイル安息香酸ヘキシル、セバシン酸ジイソプロピル、ステアリン酸グリセリル、PEG-75、ケイ酸(Na/K/Al)、ビスエチルヘキシルオキシフェノールメトキシフェニルトリアジン、酸化チタン、パルミチン酸デキストリン、ジメチコン、安息香酸アルキル(C12-15)、カンテン、アクリル酸Naグラフトデンプン、ポリアクリロイルジメチルタウリンNa、セタノール、グリセリン、EDTA-2Na、水酸化Al、ステアリン酸、ステアリルアルコール、ポリシリコーン-9、プロパンジオール、ベヘン酸グリセリル、ポリビニルアルコール、(アクリレーツ/アクリル酸アルキル(C10-30))クロスポリマー、水酸化Na、ジステアリン酸ソルビタン、AMP、ステアロキシPGヒドロキシエチルセルローススルホン酸Na、グルタミン酸、ステアロイルグルタミン酸、ローカストビーンガム、ステアロイルメチルタウリンNa、アルギニン、マルトース、アスコルビルグルコシド、ヒアルロン酸Na、BHT、フェノキシエタノール、香料,公式成分。image_url要確認。2026年版で収録。2025年限定発売の旧ページと混同しないよう現行ページ採用。
ビオレ UV アクアリッチ ライトアップエッセンス,花王,ビオレUV,SPF50+,PA++++,要確認,https://www.kao-kirei.com/ja/item/khg/bioresarasarauv/4901301390820/,https://www.kao-kirei.com/ja/item/khg/bioresarasarauv/4901301390820/,水、メトキシケイヒ酸エチルヘキシル、エタノール、BG、パルミチン酸イソプロピル、酸化チタン、ビスエチルヘキシルオキシフェノールメトキシフェニルトリアジン、エチルヘキシルトリアゾン、ジメチコン、(メタクリル酸ラウリル/メタクリル酸Na)クロスポリマー、水添ポリイソブテン、ジエチルアミノヒドロキシベンゾイル安息香酸ヘキシル、シリカ、含水シリカ、マイカ、パルミチン酸デキストリン、トリポリヒドロキシステアリン酸ジペンタエリスリチル、(アクリレーツ/アクリル酸アルキル(C10-30))クロスポリマー、トリエトキシカプリリルシラン、セタノール、ステアリン酸グリセリル、ヒドロキシエチルセルロース、ポリソルベート60、ポリシリコーン-9、水酸化Al、水酸化K、ローヤルゼリーエキス、ヒアルロン酸Na、酸化スズ、フェノキシエタノール、メチルパラベン、EDTA-2Na、BHT、香料,公式成分。トーンアップ系UV。image_url要確認。
ビオレ UV アスリズム プロテクトエッセンス,花王,ビオレUV,SPF50+,PA++++,要確認,https://www.kao-kirei.com/ja/item/khg/bioresarasarauv/4901301431073/,https://www.kao-kirei.com/ja/item/khg/bioresarasarauv/4901301431073/,水、酸化亜鉛、セバシン酸ジイソプロピル、エタノール、シリカ、サリチル酸エチルヘキシル、BG、エチルヘキシルトリアゾン、ジエチルアミノヒドロキシベンゾイル安息香酸ヘキシル、ジカプリン酸ネオペンチルグリコール、安息香酸アルキル(C12-15)、(アクリル酸Na/アクリロイルジメチルタウリンNa)コポリマー、トリエトキシカプリリルシラン、パルミチン酸デキストリン、ビスエチルヘキシルオキシフェノールメトキシフェニルトリアジン、イソヘキサデカン、ポリソルベート80、ジメチコン、ポリシリコーン-9、ヒアルロン酸Na、ユーカリ葉エキス、EDTA-2Na、香料,公式成分。image_url要確認。
ビオレ UV キッズ ピュアミルク,花王,ビオレUV,SPF50+,PA+++,要確認,https://www.kao-kirei.com/ja/item/khg/bioresarasarauv/4901301378453/,https://www.biccamera.com/bc/item/7714903/,シクロペンタシロキサン、酸化亜鉛、水添ポリイソブテン、BG、酸化チタン、ジメチコン、安息香酸アルキル(C12-15)、ジカプリン酸ネオペンチルグリコール、ステアリン酸、ジポリヒドロキシステアリン酸PEG-30、水酸化Al、トリエトキシカプリリルシラン、アルキル(C30-45)ジメチルシリルポリプロピルシルセスキオキサン、水、DPG、イソステアリン酸ソルビタン、グリセリン、シア脂,成分は公式、PAは信頼できる小売掲載で補完。image_url要確認。
ダブルプロテクション デイシールド n,資生堂,BAUM,SPF50+,PA++++,要確認,https://www.shiseido.co.jp/sw/onlinestore/products/H61401.html,https://www.shiseido.co.jp/sw/onlinestore/products/H61401.html,"酸化亜鉛,トリ(カプリル酸/カプリン酸)グリセリル,スクワラン,シリカ,酸化チタン,ウンデカン,イソドデカン,パルミチン酸エチルヘキシル,ポリリシノレイン酸ポリグリセリル-6,トリデカン,パルミチン酸デキストリン,水酸化Al,ステアリン酸,グリセリン,DPG,ミリスチン酸ミリスチル,アルガニアスピノサ核油,ホホバ種子油,サクラ葉エキス,イチョウ葉エキス,ヨーロッパブナ芽エキス,メタケイ酸アルミン酸Mg,結晶セルロース,ポリヒドロキシステアリン酸,ジステアルジモニウムヘクトライト,水,BG,トコフェロール,BHT,ピロ亜硫酸Na,フトモモ葉エキス,セルロース,フェノキシエタノール,香料",2025/02/27発売のn版。公式成分。
アーバン トリプル ビューティ サンケア エマルジョン,資生堂,SHISEIDO,SPF50+,PA++++,要確認,https://www.shiseido.co.jp/sw/c/products/SWFG070410.seam?shohin_pl_c_cd=G17701,https://www.shiseido.co.jp/sw/c/products/SWFG070410.seam?shohin_pl_c_cd=G17701,"トリシロキサン,酸化亜鉛,セバシン酸ジイソプロピル,水,シリカ,オクトクリレン,エタノール,安息香酸アルキル(C12-15),ポリシリコーン-15,ジメチコン,グリセリン,コハク酸ジエチルヘキシル,PEG/PPG-14/7ジメチルエーテル,ジエチルアミノヒドロキシベンゾイル安息香酸ヘキシル,ジピバリン酸PPG-3,酸化チタン,PEG-9ポリジメチルシロキシエチルジメチコン,パルミチン酸デキストリン,トレハロース,ビスブチルジメチコンポリグリセリル-3,エチルヘキサン酸セチル,トリ酢酸テトラステアリン酸スクロース,ビスエチルヘキシルオキシフェノールメトキシフェニルトリアジン,テトラヘキシルデカン酸アスコルビル,グリチルリチン酸2K,チオタウリン,オウゴン根エキス,シャクヤク根エキス,ヒアルロン酸Na,ワレモコウエキス,チャ葉エキス,オノニスエキス,ウコン根茎エキス,シソ葉エキス,スピルリナプラテンシスエキス,PEG-10ジメチコン,トリエトキシカプリリルシラン,エチルヘキシルトリアゾン,BG,ジステアルジモニウムヘクトライト,水酸化Al,ステアリン酸,EDTA-3Na,トコフェロール,BHT,ピロ亜硫酸Na,メントキシプロパンジオール,フトモモ葉エキス,クエン酸Na,安息香酸,香料,合成金雲母,硫酸Ba",都市環境向けのUV乳液。公式成分。
パーフェクト サン プロテクター スティック,資生堂,SHISEIDO,SPF50+,PA++++,要確認,https://brand.shiseido.co.jp/shiseido-perfect-sun-protector-stick-4514254206171.html,https://www.cosme.net/products/10267299/,"ジフェニルシロキシフェニルトリメチコン,ミネラルオイル,オクトクリレン,ヒドロキシステアリン酸,トリエチルヘキサノイン,メタクリル酸メチルクロスポリマー,PEG/PPG-9/2ジメチルエーテル,サリチル酸エチルヘキシル,水添ポリデセン,安息香酸アルキル(C12-15),t-ブチルメトキシジベンゾイルメタン,ジエチルアミノヒドロキシベンゾイル安息香酸ヘキシル,セバシン酸ジイソプロピル,ジブチルラウロイルグルタミド,ビスエチルヘキシルオキシフェノールメトキシフェニルトリアジン,ポリアミド-8,トリイソステアリン,ジメチルシリル化シリカ,アルガニアスピノサ核油,PEG/PPG-14/7ジメチルエーテル,酢酸トコフェロール,レシチン,甘草フラボノイド,トコフェロール,BHT,シメチコン,PEG-6,テトラ(ジ-t-ブチルヒドロキシヒドロケイヒ酸)ペンタエリスリチル,シリカ,香料",2025/03/01発売。成分は@cosme掲載の全成分を採用。
パーフェクト サン プロテクター スプレー,資生堂,SHISEIDO,SPF50+,PA++++,要確認,https://www.shiseido.co.jp/sw/products/SWFG070410.seam?shohin_pl_c_cd=H60901,https://www.shiseido.co.jp/sw/products/SWFG070410.seam?shohin_pl_c_cd=H60901,"エタノール,テトラエチルヘキサン酸ペンタエリスリチル,セバシン酸ジイソプロピル,トリイソステアリン,オクトクリレン,ポリシリコーン-15,サリチル酸エチルヘキシル,安息香酸アルキル(C12-15),安息香酸フェネチル,カプリリルメチコン,ジエチルアミノヒドロキシベンゾイル安息香酸ヘキシル,t-ブチルメトキシジベンゾイルメタン,エチルヘキシルトリアゾン,PEG/PPG-9/2ジメチルエーテル,ビスエチルヘキシルオキシフェノールメトキシフェニルトリアジン,(アクリレーツ/オクチルアクリルアミド)コポリマー,ブドウ種子油,アルガニアスピノサ核油,PEG/PPG-14/7ジメチルエーテル,酢酸トコフェロール,甘草フラボノイド,ポリアミド-8,ポリリシノレイン酸ポリグリセリル-6,BHT,ヒドロキシステアリン酸,テリハボク種子油,テトラ(ジ-t-ブチルヒドロキシヒドロケイヒ酸)ペンタエリスリチル,シリカ,香料",2026/03/01発売。肌にも髪にも使えるスプレータイプ。公式成分。
パーフェクト サン プロテクター ハイドロ ジェルクリーム,資生堂,SHISEIDO,SPF50+,PA++++,要確認,https://brand.shiseido.co.jp/shiseido-perfect-sun-protector-hydro-gelcream-4514254201473.html,https://www.shiseido.co.jp/sw/onlinestore/products/H61001.html,"水,エタノール,セバシン酸ジイソプロピル,オクトクリレン,サリチル酸エチルヘキシル,酸化チタン,イソドデカン,ジメチコン,PEG/PPG-9/2ジメチルエーテル,グリセリン,シリカ,PEG-60水添ヒマシ油,ビスエチルヘキシルオキシフェノールメトキシフェニルトリアジン,ジエチルアミノヒドロキシベンゾイル安息香酸ヘキシル,(アクリルアミド/アクリル酸DMAPA/メタクリル酸メトキシPEG)コポリマー,エチルヘキシルトリアゾン,t-ブチルメトキシジベンゾイルメタン,キサンタンガム,グリチルリチン酸2K,PEG/PPG-14/7ジメチルエーテル,アミノエタンスルフィン酸,ハッカ油,ユキノシタエキス,チャ葉エキス,トゲキリンサイ/ヒヂリメン/ミツイシコンブ/ウスバアオノリ/ワカメエキス,クララ根エキス,ミツイシコンブ/ワカメエキス,セスキイソステアリン酸ソルビタン,ポリリシノレイン酸ポリグリセリル-6,水酸化K,リン酸セチル,カルボマー,(アクリレーツ/アクリル酸アルキル(C10-30))クロスポリマー,(パルミチン酸/エチルヘキサン酸)デキストリン,(ジメチルアクリルアミド/アクリロイルジメチルタウリンNa)クロスポリマー,ステアロキシヒドロキシプロピルメチルセルロース,BHT,BG,ステアリン酸,パルミチン酸デキストリン,フトモモ葉エキス,フェノキシエタノール,香料",2025/03/01発売。公式成分。
パーフェクト サン プロテクター ローション,資生堂,SHISEIDO,SPF50+,PA++++,要確認,https://brand.shiseido.co.jp/shiseido-the-perfect-protector-4514254962886.html,https://www.cosme.net/variations/1197959/,"水,トリシロキサン,酸化亜鉛,ジメチコン,エタノール,オクトクリレン,タルク,サリチル酸エチルヘキシル,安息香酸アルキル(C12-15),シリカ,グリセリン,セバシン酸ジイソプロピル,PEG/PPG-9/2ジメチルエーテル,コーンスターチ,ミリスチン酸イソプロピル,ジエチルアミノヒドロキシベンゾイル安息香酸ヘキシル,パルミチン酸デキストリン,酸化チタン,PEG-9ポリジメチルシロキシエチルジメチコン,ポリリシノレイン酸ポリグリセリル-6,ホモサレート,ビスエチルヘキシルオキシフェノールメトキシフェニルトリアジン,トレハロース,塩化Na,グリチルリチン酸2K,PEG/PPG-14/7ジメチルエーテル,アミノエタンスルフィン酸,ユキノシタエキス,チャ葉エキス,トゲキリンサイ/ヒヂリメン/ミツイシコンブ/ウスバアオノリ/ワカメエキス,ヒアルロン酸Na,クララ根エキス,ミツイシコンブ/ワカメエキス,エチルヘキシルトリアゾン,ジステアルジモニウムヘクトライト,PEG-10ジメチコン,イソステアリン酸,トリエトキシカプリリルシラン,水酸化Al,ステアリン酸,EDTA-3Na,トコフェロール,BHT,BG,ビスブチルジメチコンポリグリセリル-3,PEG-6,ピロ亜硫酸Na,フトモモ葉エキス,香料,赤227,黄5,黄4",2025/03/01発売。成分は@cosme掲載の全成分を採用。
パーフェクト サン プロテクター ローション センシティブ,資生堂,SHISEIDO,SPF50+,PA++++,要確認,https://brand.shiseido.co.jp/shiseido-perfect-sun-protector-lotion-sensitive-4514254201510.html,https://www.cosme.net/products/10267296/,"ジメチコン,セバシン酸ジイソプロピル,水,シリカ,酸化亜鉛,エチルヘキサン酸セチル,BG,テトラエチルヘキサン酸ペンタエリスリチル,トリエチルヘキサノイン,カプリリルメチコン,コハク酸ジエチルヘキシル,酸化チタン,グリセリン,PEG-9ポリジメチルシロキシエチルジメチコン,ジエチルアミノヒドロキシベンゾイル安息香酸ヘキシル,エチルヘキシルトリアゾン,ジステアルジモニウムヘクトライト,パルミチン酸デキストリン,トリメチルシロキシケイ酸,ビスエチルヘキシルオキシフェノールメトキシフェニルトリアジン,塩化Na,グリチルリチン酸2K,PEG/PPG-14/7ジメチルエーテル,オウゴン根エキス,キイチゴエキス,ハマメリス葉エキス,アロエベラ葉エキス,ワイルドタイムエキス,トゲキリンサイ/ヒヂリメン/ミツイシコンブ/ウスバアオノリ/ワカメエキス,ミツイシコンブ/ワカメエキス,含水シリカ,イソステアリン酸,PEG-10ジメチコン,トリエトキシカプリリルシラン,水添パーム油,ハイドロゲンジメチコン,パーム核油,パーム油,クエン酸Na,ステアリン酸,ピロ亜硫酸Na,フトモモ葉エキス,トコフェロール,クエン酸,フェノキシエタノール",2025/03/01発売。成分は@cosme掲載の全成分を採用。
クリアスティック UVプロテクター,資生堂,SHISEIDO メン,SPF50+,PA++++,要確認,https://brand.shiseido.co.jp/shiseido-men-clear-stick-uv-protector-4514254992425.html,https://www.cosmetic-info.jp/prod/detail.php?id=84564,"ジフェニルシロキシフェニルトリメチコン,ホモサレート,オクトクリレン,ミネラルオイル,ヒドロキシステアリン酸,トリエチルヘキサノイン,サリチル酸エチルヘキシル,メタクリル酸メチルクロスポリマー,PEG/PPG-9/2ジメチルエーテル,t-ブチルメトキシジベンゾイルメタン,ジエチルアミノヒドロキシベンゾイル安息香酸ヘキシル,安息香酸アルキル(C12-15),ジブチルラウロイルグルタミド,ビスエチルヘキシルオキシフェノールメトキシフェニルトリアジン,ポリアミド-8,ジメチルシリル化シリカ,ツバキ種子油,PEG/PPG-14/7ジメチルエーテル,テトラヘキシルデカン酸アスコルビル,酢酸トコフェロール,PPG-17,BHT,トコフェロール,PEG-6,テトラ(ジ-t-ブチルヒドロキシヒドロケイヒ酸)ペンタエリスリチル,シリカ,香料",男性用日焼け止め。成分はCosmetic-Info掲載を採用。
アレルバリア エッセンス BB N,資生堂,d プログラム,SPF50+,PA+++,要確認,https://www.shiseido.co.jp/sw/onlinestore/products/F39801.html,https://www.shiseido.co.jp/sw/onlinestore/products/F39801.html,"ジメチコン,酸化チタン,水,酸化亜鉛,グリセリン,DPG,ジフェニルシロキシフェニルトリメチコン,PEG-10ジメチコン,セバシン酸ジイソプロピル,シリカ,PEG-9ポリジメチルシロキシエチルジメチコン,ビスブチルジメチコンポリグリセリル-3,水酸化Al,ジフェニルジメチコン,エリスリトール,トレハロース,キシリトール,トリメチルシロキシケイ酸,メタケイ酸アルミン酸Mg,オウゴン根エキス,グルタチオン,ポリクオタニウム-51,アセチルヒアルロン酸Na,ステアリン酸,イソステアリン酸,トリエトキシカプリリルシラン,ハイドロゲンジメチコン,含水シリカ,ジステアルジモニウムヘクトライト,BG,テトラヒドロテトラメチルシクロテトラシロキサン,トコフェロール,メタリン酸Na,テトラデセン,クエン酸Na,クエン酸,ピロ亜硫酸Na,フトモモ葉エキス,フェノキシエタノール,酸化鉄,マイカ",ライト/ミディアムの色違いは1商品に統合。UV下地として対象。
アレルバリア エッセンス N,資生堂,d プログラム,SPF50+,PA+++,要確認,https://www.shiseido.co.jp/sw/onlinestore/products/F39701.html?online_shohin_ctlg_kbn=1&shohin_pl_c_cd=F39701,https://www.shiseido.co.jp/sw/products/auth/SWFG070410.seam?online_shohin_ctlg_kbn=2&shohin_pl_c_cd=F39701,"ジメチコン,水,酸化チタン,酸化亜鉛,グリセリン,DPG,ジフェニルシロキシフェニルトリメチコン,セバシン酸ジイソプロピル,PEG-9ポリジメチルシロキシエチルジメチコン,ビスブチルジメチコンポリグリセリル-3,PEG-10ジメチコン,タルク,含水シリカ,水酸化Al,シリカ,ジフェニルジメチコン,エリスリトール,トレハロース,キシリトール,トリメチルシロキシケイ酸,メタケイ酸アルミン酸Mg,グルタチオン,ポリクオタニウム-51,アセチルヒアルロン酸Na,ハイドロゲンジメチコン,ステアリン酸,ジステアルジモニウムヘクトライト,クエン酸,クエン酸Na,メタリン酸Na,BG,ピロ亜硫酸Na,フトモモ葉エキス,トコフェロール,フェノキシエタノール",UV下地としても使える日中用美容液。公式成分。
アレルバリア クリーム N,資生堂,d プログラム,SPF30,PA+++,要確認,https://www.shiseido.co.jp/sw/onlinestore/products/F40001.html?shohin_pl_c_cd=F40001,https://www.shiseido.co.jp/sw/onlinestore/products/F40001.html?shohin_pl_c_cd=F40001,"水,ジメチコン,酸化亜鉛,BG,酸化チタン,トリエチルヘキサノイン,カプリリルメチコン,グリセリン,PEG-9ポリジメチルシロキシエチルジメチコン,タルク,ジステアルジモニウムヘクトライト,パルミチン酸デキストリン,水酸化Al,シリカ,エリスリトール,トレハロース,キシリトール,トリメチルシロキシケイ酸,塩化Na,メタケイ酸アルミン酸Mg,グルタチオン,ポリクオタニウム-51,アセチルヒアルロン酸Na,PEG-10ジメチコン,ステアリン酸,ビスブチルジメチコンポリグリセリル-3,イソステアリン酸,クエン酸Na,メタリン酸Na,ピロ亜硫酸Na,クエン酸,フトモモ葉エキス,トコフェロール,フェノキシエタノール",公式で在庫限り販売終了予定と明記。現行終売予定品として記録。
セルフバリア UVミルク,資生堂,アクアレーベル,SPF50+,PA++++,要確認,https://www.shiseido.co.jp/sw/onlinestore/products/G11101.html,https://www.shiseido.co.jp/sw/onlinestore/products/G11101.html,"水,メトキシケイヒ酸エチルヘキシル,BG,酸化亜鉛,イソヘキサデカン,グリセリン,安息香酸アルキル(C12-15),シリカ,酸化チタン,PEG-60水添ヒマシ油,ビスエチルヘキシルオキシフェノールメトキシフェニルトリアジン,カンテン,含水シリカ,ジメチコン,ジエチルアミノヒドロキシベンゾイル安息香酸ヘキシル,塩化Mg,トレハロース,PEG/PPG-14/7ジメチルエーテル,オウゴン根エキス,グルタミン酸,ラベンダー油,アシタバ葉/茎エキス,ヒアルロン酸Na,メチオニン,アスペルギルス/ツバキ種子発酵エキス液,加水分解コメエキス,オクラ果実エキス,イソステアリン酸,PEG-100水添ヒマシ油,(パルミチン酸/エチルヘキサン酸)デキストリン,水酸化Al,セスキイソステアリン酸ソルビタン,ハイドロゲンジメチコン,サクシノグリカン,ステアロキシヒドロキシプロピルメチルセルロース,ジステアリルジモニウムクロリド,BHT,トコフェロール,ピロ亜硫酸Na,EDTA-2Na,イソプロパノール,アラニン,ソメイヨシノ葉エキス,フェノキシエタノール,クロルフェネシン",乳液・UVカット・化粧下地の3役。UV下地として対象。
